<?xml version="1.0" encoding="UTF-8"?>

<xs:schema xmlns:xs="http://www.w3.org/2001/XMLSchema">

    <xs:element name="library">
        <xs:complexType>
            <xs:sequence>
                <xs:element name="shelf" maxOccurs="unbounded">
                    <xs:complexType>
                        <xs:sequence>

                            <xs:element name="category" type="xs:string"/>

                            <xs:element name="books">
                                <xs:complexType>
                                    <xs:sequence>

                                        <xs:element name="book" maxOccurs="unbounded">
                                            <xs:complexType>
                                                <xs:sequence>
                                                    <xs:element name="title" type="xs:string"/>
                                                    <xs:element name="release_year" type="xs:int"/>
                                                    <xs:element name="author" type="xs:string"/>
                                                </xs:sequence>
                                            </xs:complexType>
                                        </xs:element>

                                    </xs:sequence>
                                </xs:complexType>
                            </xs:element>

                        </xs:sequence>
                    </xs:complexType>
                </xs:element>

            </xs:sequence>
        </xs:complexType>
    </xs:element>

</xs:schema>